
*** Running vivado
    with args -log design_1_wrapper.vdi -applog -m64 -product Vivado -messageDb vivado.pb -mode batch -source design_1_wrapper.tcl -notrace


ECHO は <OFF> です。
ECHO は <OFF> です。

****** Vivado v2023.2 (64-bit)
  **** SW Build 4029153 on Fri Oct 13 20:14:34 MDT 2023
  **** IP Build 4028589 on Sat Oct 14 00:45:43 MDT 2023
  **** SharedData Build 4025554 on Tue Oct 10 17:18:54 MDT 2023
    ** Copyright 1986-2022 Xilinx, Inc. All Rights Reserved.
    ** Copyright 2022-2023 Advanced Micro Devices, Inc. All Rights Reserved.

source design_1_wrapper.tcl -notrace
Command: open_checkpoint C:/Users/USER/Desktop/EBAZ4205/XilinxFPGA_SE/EBZA4205/05_Zynq7000/project_1/project_1.runs/impl_1/design_1_wrapper.dcp
INFO: [Device 21-403] Loading part xc7z010clg400-1
Netlist sorting complete. Time (s): cpu = 00:00:00 ; elapsed = 00:00:00.084 . Memory (MB): peak = 851.883 ; gain = 0.000
INFO: [Netlist 29-17] Analyzing 23 Unisim elements for replacement
INFO: [Netlist 29-28] Unisim Transformation completed in 0 CPU seconds
INFO: [Project 1-479] Netlist was created with Vivado 2023.2
INFO: [Project 1-570] Preparing netlist for logic optimization
Read ShapeDB Complete: Time (s): cpu = 00:00:00 ; elapsed = 00:00:00.022 . Memory (MB): peak = 952.066 ; gain = 0.543
INFO: [Timing 38-478] Restoring timing data from binary archive.
INFO: [Timing 38-479] Binary timing data restore complete.
INFO: [Project 1-856] Restoring constraints from binary archive.
INFO: [Project 1-853] Binary constraint restore complete.
INFO: [Designutils 20-5722] Start Reading Physical Databases.
Reading placement.
Read Netlist Cache: Time (s): cpu = 00:00:00 ; elapsed = 00:00:00.003 . Memory (MB): peak = 1466.730 ; gain = 0.000
Reading placer database...
Read Device Cache: Time (s): cpu = 00:00:00 ; elapsed = 00:00:00.065 . Memory (MB): peak = 1466.730 ; gain = 0.000
Read PlaceDB: Time (s): cpu = 00:00:00 ; elapsed = 00:00:00.316 . Memory (MB): peak = 1466.730 ; gain = 0.000
Read PulsedLatchDB: Time (s): cpu = 00:00:00 ; elapsed = 00:00:00 . Memory (MB): peak = 1466.730 ; gain = 0.000
Reading routing.
Read RouteStorage: Time (s): cpu = 00:00:00 ; elapsed = 00:00:00.039 . Memory (MB): peak = 1466.730 ; gain = 0.000
Read Physdb Files: Time (s): cpu = 00:00:00 ; elapsed = 00:00:00.475 . Memory (MB): peak = 1466.730 ; gain = 0.000
Restored from archive | CPU: 0.000000 secs | Memory: 0.000000 MB |
Finished XDEF File Restore: Time (s): cpu = 00:00:00 ; elapsed = 00:00:00.653 . Memory (MB): peak = 1466.730 ; gain = 0.000
Netlist sorting complete. Time (s): cpu = 00:00:00 ; elapsed = 00:00:00.001 . Memory (MB): peak = 1466.730 ; gain = 0.000
INFO: [Project 1-111] Unisim Transformation Summary:
  A total of 5 instances were transformed.
  IOBUF => IOBUF (IBUF, OBUFT): 5 instances

指定されたパスが見つかりません。
INFO: [Project 1-604] Checkpoint was created with Vivado v2023.2 (64-bit) build 4029153
open_checkpoint: Time (s): cpu = 00:00:19 ; elapsed = 00:00:36 . Memory (MB): peak = 1466.730 ; gain = 1196.910
Command: opt_design
Attempting to get a license for feature 'Implementation' and/or device 'xc7z010'
INFO: [Common 17-349] Got license for feature 'Implementation' and/or device 'xc7z010'
Running DRC as a precondition to command opt_design

Starting DRC Task
INFO: [DRC 23-27] Running DRC with 2 threads
INFO: [Project 1-461] DRC finished with 0 Errors
INFO: [Project 1-462] Please refer to the DRC report (report_drc) for more information.

Time (s): cpu = 00:00:02 ; elapsed = 00:00:03 . Memory (MB): peak = 1482.637 ; gain = 15.906

Starting Cache Timing Information Task
INFO: [Timing 38-35] Done setting XDC timing constraints.
Ending Cache Timing Information Task | Checksum: 1625e9daf

Time (s): cpu = 00:00:00 ; elapsed = 00:00:00.268 . Memory (MB): peak = 1552.418 ; gain = 69.781

Starting Logic Optimization Task

Phase 1 Initialization

Phase 1.1 Core Generation And Design Setup
Phase 1.1 Core Generation And Design Setup | Checksum: 1625e9daf

Time (s): cpu = 00:00:00 ; elapsed = 00:00:00.007 . Memory (MB): peak = 1909.492 ; gain = 0.000

Phase 1.2 Setup Constraints And Sort Netlist
Phase 1.2 Setup Constraints And Sort Netlist | Checksum: 1625e9daf

Time (s): cpu = 00:00:00 ; elapsed = 00:00:00.013 . Memory (MB): peak = 1909.492 ; gain = 0.000
Phase 1 Initialization | Checksum: 1625e9daf

Time (s): cpu = 00:00:00 ; elapsed = 00:00:00.016 . Memory (MB): peak = 1909.492 ; gain = 0.000

Phase 2 Timer Update And Timing Data Collection

Phase 2.1 Timer Update
Phase 2.1 Timer Update | Checksum: 1625e9daf

Time (s): cpu = 00:00:00 ; elapsed = 00:00:00.083 . Memory (MB): peak = 1909.492 ; gain = 0.000

Phase 2.2 Timing Data Collection
Phase 2.2 Timing Data Collection | Checksum: 1625e9daf

Time (s): cpu = 00:00:00 ; elapsed = 00:00:00.117 . Memory (MB): peak = 1909.492 ; gain = 0.000
Phase 2 Timer Update And Timing Data Collection | Checksum: 1625e9daf

Time (s): cpu = 00:00:00 ; elapsed = 00:00:00.120 . Memory (MB): peak = 1909.492 ; gain = 0.000

Phase 3 Retarget
INFO: [Opt 31-138] Pushed 0 inverter(s) to 0 load pin(s).
INFO: [Opt 31-49] Retargeted 0 cell(s).
Phase 3 Retarget | Checksum: 1cbaacf0f

Time (s): cpu = 00:00:00 ; elapsed = 00:00:00.347 . Memory (MB): peak = 1909.492 ; gain = 0.000
Retarget | Checksum: 1cbaacf0f
INFO: [Opt 31-389] Phase Retarget created 4 cells and removed 29 cells
INFO: [Opt 31-1021] In phase Retarget, 6 netlist objects are constrained preventing optimization. Please run opt_design with -debug_log to get more detail. 

Phase 4 Constant propagation
INFO: [Opt 31-138] Pushed 0 inverter(s) to 0 load pin(s).
Phase 4 Constant propagation | Checksum: 1d5e5bdb1

Time (s): cpu = 00:00:00 ; elapsed = 00:00:00.380 . Memory (MB): peak = 1909.492 ; gain = 0.000
Constant propagation | Checksum: 1d5e5bdb1
INFO: [Opt 31-389] Phase Constant propagation created 0 cells and removed 30 cells

Phase 5 Sweep
Phase 5 Sweep | Checksum: 1843af04c

Time (s): cpu = 00:00:00 ; elapsed = 00:00:00.614 . Memory (MB): peak = 1909.492 ; gain = 0.000
Sweep | Checksum: 1843af04c
INFO: [Opt 31-389] Phase Sweep created 0 cells and removed 174 cells

Phase 6 BUFG optimization
Phase 6 BUFG optimization | Checksum: 1843af04c

Time (s): cpu = 00:00:00 ; elapsed = 00:00:00.698 . Memory (MB): peak = 1909.492 ; gain = 0.000
BUFG optimization | Checksum: 1843af04c
INFO: [Opt 31-662] Phase BUFG optimization created 0 cells of which 0 are BUFGs and removed 0 cells.

Phase 7 Shift Register Optimization
WARNING: [Opt 31-1131] Can not pull register out from design_1_i/ps7_0_axi_periph/s00_couplers/auto_pc/inst/gen_axilite.gen_b2s_conv.axilite_b2s/RD.r_channel_0/rd_data_fifo_0/memory_reg[31][0]_srl32 due to none static srl address bits
WARNING: [Opt 31-1131] Can not pull register out from design_1_i/ps7_0_axi_periph/s00_couplers/auto_pc/inst/gen_axilite.gen_b2s_conv.axilite_b2s/RD.r_channel_0/rd_data_fifo_0/memory_reg[31][10]_srl32 due to none static srl address bits
WARNING: [Opt 31-1131] Can not pull register out from design_1_i/ps7_0_axi_periph/s00_couplers/auto_pc/inst/gen_axilite.gen_b2s_conv.axilite_b2s/RD.r_channel_0/rd_data_fifo_0/memory_reg[31][11]_srl32 due to none static srl address bits
WARNING: [Opt 31-1131] Can not pull register out from design_1_i/ps7_0_axi_periph/s00_couplers/auto_pc/inst/gen_axilite.gen_b2s_conv.axilite_b2s/RD.r_channel_0/rd_data_fifo_0/memory_reg[31][12]_srl32 due to none static srl address bits
WARNING: [Opt 31-1131] Can not pull register out from design_1_i/ps7_0_axi_periph/s00_couplers/auto_pc/inst/gen_axilite.gen_b2s_conv.axilite_b2s/RD.r_channel_0/rd_data_fifo_0/memory_reg[31][13]_srl32 due to none static srl address bits
WARNING: [Opt 31-1131] Can not pull register out from design_1_i/ps7_0_axi_periph/s00_couplers/auto_pc/inst/gen_axilite.gen_b2s_conv.axilite_b2s/RD.r_channel_0/rd_data_fifo_0/memory_reg[31][14]_srl32 due to none static srl address bits
WARNING: [Opt 31-1131] Can not pull register out from design_1_i/ps7_0_axi_periph/s00_couplers/auto_pc/inst/gen_axilite.gen_b2s_conv.axilite_b2s/RD.r_channel_0/rd_data_fifo_0/memory_reg[31][15]_srl32 due to none static srl address bits
WARNING: [Opt 31-1131] Can not pull register out from design_1_i/ps7_0_axi_periph/s00_couplers/auto_pc/inst/gen_axilite.gen_b2s_conv.axilite_b2s/RD.r_channel_0/rd_data_fifo_0/memory_reg[31][16]_srl32 due to none static srl address bits
WARNING: [Opt 31-1131] Can not pull register out from design_1_i/ps7_0_axi_periph/s00_couplers/auto_pc/inst/gen_axilite.gen_b2s_conv.axilite_b2s/RD.r_channel_0/rd_data_fifo_0/memory_reg[31][17]_srl32 due to none static srl address bits
WARNING: [Opt 31-1131] Can not pull register out from design_1_i/ps7_0_axi_periph/s00_couplers/auto_pc/inst/gen_axilite.gen_b2s_conv.axilite_b2s/RD.r_channel_0/rd_data_fifo_0/memory_reg[31][18]_srl32 due to none static srl address bits
WARNING: [Opt 31-1131] Can not pull register out from design_1_i/ps7_0_axi_periph/s00_couplers/auto_pc/inst/gen_axilite.gen_b2s_conv.axilite_b2s/RD.r_channel_0/rd_data_fifo_0/memory_reg[31][19]_srl32 due to none static srl address bits
WARNING: [Opt 31-1131] Can not pull register out from design_1_i/ps7_0_axi_periph/s00_couplers/auto_pc/inst/gen_axilite.gen_b2s_conv.axilite_b2s/RD.r_channel_0/rd_data_fifo_0/memory_reg[31][1]_srl32 due to none static srl address bits
WARNING: [Opt 31-1131] Can not pull register out from design_1_i/ps7_0_axi_periph/s00_couplers/auto_pc/inst/gen_axilite.gen_b2s_conv.axilite_b2s/RD.r_channel_0/rd_data_fifo_0/memory_reg[31][20]_srl32 due to none static srl address bits
WARNING: [Opt 31-1131] Can not pull register out from design_1_i/ps7_0_axi_periph/s00_couplers/auto_pc/inst/gen_axilite.gen_b2s_conv.axilite_b2s/RD.r_channel_0/rd_data_fifo_0/memory_reg[31][21]_srl32 due to none static srl address bits
WARNING: [Opt 31-1131] Can not pull register out from design_1_i/ps7_0_axi_periph/s00_couplers/auto_pc/inst/gen_axilite.gen_b2s_conv.axilite_b2s/RD.r_channel_0/rd_data_fifo_0/memory_reg[31][22]_srl32 due to none static srl address bits
WARNING: [Opt 31-1131] Can not pull register out from design_1_i/ps7_0_axi_periph/s00_couplers/auto_pc/inst/gen_axilite.gen_b2s_conv.axilite_b2s/RD.r_channel_0/rd_data_fifo_0/memory_reg[31][23]_srl32 due to none static srl address bits
WARNING: [Opt 31-1131] Can not pull register out from design_1_i/ps7_0_axi_periph/s00_couplers/auto_pc/inst/gen_axilite.gen_b2s_conv.axilite_b2s/RD.r_channel_0/rd_data_fifo_0/memory_reg[31][24]_srl32 due to none static srl address bits
WARNING: [Opt 31-1131] Can not pull register out from design_1_i/ps7_0_axi_periph/s00_couplers/auto_pc/inst/gen_axilite.gen_b2s_conv.axilite_b2s/RD.r_channel_0/rd_data_fifo_0/memory_reg[31][25]_srl32 due to none static srl address bits
WARNING: [Opt 31-1131] Can not pull register out from design_1_i/ps7_0_axi_periph/s00_couplers/auto_pc/inst/gen_axilite.gen_b2s_conv.axilite_b2s/RD.r_channel_0/rd_data_fifo_0/memory_reg[31][26]_srl32 due to none static srl address bits
WARNING: [Opt 31-1131] Can not pull register out from design_1_i/ps7_0_axi_periph/s00_couplers/auto_pc/inst/gen_axilite.gen_b2s_conv.axilite_b2s/RD.r_channel_0/rd_data_fifo_0/memory_reg[31][27]_srl32 due to none static srl address bits
WARNING: [Opt 31-1131] Can not pull register out from design_1_i/ps7_0_axi_periph/s00_couplers/auto_pc/inst/gen_axilite.gen_b2s_conv.axilite_b2s/RD.r_channel_0/rd_data_fifo_0/memory_reg[31][28]_srl32 due to none static srl address bits
WARNING: [Opt 31-1131] Can not pull register out from design_1_i/ps7_0_axi_periph/s00_couplers/auto_pc/inst/gen_axilite.gen_b2s_conv.axilite_b2s/RD.r_channel_0/rd_data_fifo_0/memory_reg[31][29]_srl32 due to none static srl address bits
WARNING: [Opt 31-1131] Can not pull register out from design_1_i/ps7_0_axi_periph/s00_couplers/auto_pc/inst/gen_axilite.gen_b2s_conv.axilite_b2s/RD.r_channel_0/rd_data_fifo_0/memory_reg[31][2]_srl32 due to none static srl address bits
WARNING: [Opt 31-1131] Can not pull register out from design_1_i/ps7_0_axi_periph/s00_couplers/auto_pc/inst/gen_axilite.gen_b2s_conv.axilite_b2s/RD.r_channel_0/rd_data_fifo_0/memory_reg[31][30]_srl32 due to none static srl address bits
WARNING: [Opt 31-1131] Can not pull register out from design_1_i/ps7_0_axi_periph/s00_couplers/auto_pc/inst/gen_axilite.gen_b2s_conv.axilite_b2s/RD.r_channel_0/rd_data_fifo_0/memory_reg[31][31]_srl32 due to none static srl address bits
WARNING: [Opt 31-1131] Can not pull register out from design_1_i/ps7_0_axi_periph/s00_couplers/auto_pc/inst/gen_axilite.gen_b2s_conv.axilite_b2s/RD.r_channel_0/rd_data_fifo_0/memory_reg[31][9]_srl32 due to none static srl address bits
WARNING: [Opt 31-1131] Can not pull register out from design_1_i/ps7_0_axi_periph/s00_couplers/auto_pc/inst/gen_axilite.gen_b2s_conv.axilite_b2s/RD.r_channel_0/rd_data_fifo_0/memory_reg[31][8]_srl32 due to none static srl address bits
WARNING: [Opt 31-1131] Can not pull register out from design_1_i/ps7_0_axi_periph/s00_couplers/auto_pc/inst/gen_axilite.gen_b2s_conv.axilite_b2s/RD.r_channel_0/rd_data_fifo_0/memory_reg[31][3]_srl32 due to none static srl address bits
WARNING: [Opt 31-1131] Can not pull register out from design_1_i/ps7_0_axi_periph/s00_couplers/auto_pc/inst/gen_axilite.gen_b2s_conv.axilite_b2s/RD.r_channel_0/rd_data_fifo_0/memory_reg[31][4]_srl32 due to none static srl address bits
WARNING: [Opt 31-1131] Can not pull register out from design_1_i/ps7_0_axi_periph/s00_couplers/auto_pc/inst/gen_axilite.gen_b2s_conv.axilite_b2s/RD.r_channel_0/rd_data_fifo_0/memory_reg[31][5]_srl32 due to none static srl address bits
WARNING: [Opt 31-1131] Can not pull register out from design_1_i/ps7_0_axi_periph/s00_couplers/auto_pc/inst/gen_axilite.gen_b2s_conv.axilite_b2s/RD.r_channel_0/rd_data_fifo_0/memory_reg[31][6]_srl32 due to none static srl address bits
WARNING: [Opt 31-1131] Can not pull register out from design_1_i/ps7_0_axi_periph/s00_couplers/auto_pc/inst/gen_axilite.gen_b2s_conv.axilite_b2s/RD.r_channel_0/rd_data_fifo_0/memory_reg[31][7]_srl32 due to none static srl address bits
WARNING: [Opt 31-1131] Can not pull register out from design_1_i/ps7_0_axi_periph/s00_couplers/auto_pc/inst/gen_axilite.gen_b2s_conv.axilite_b2s/RD.r_channel_0/transaction_fifo_0/memory_reg[31][0]_srl32 due to none static srl address bits
WARNING: [Opt 31-1131] Can not pull register out from design_1_i/ps7_0_axi_periph/s00_couplers/auto_pc/inst/gen_axilite.gen_b2s_conv.axilite_b2s/RD.r_channel_0/transaction_fifo_0/memory_reg[31][10]_srl32 due to none static srl address bits
WARNING: [Opt 31-1131] Can not pull register out from design_1_i/ps7_0_axi_periph/s00_couplers/auto_pc/inst/gen_axilite.gen_b2s_conv.axilite_b2s/RD.r_channel_0/transaction_fifo_0/memory_reg[31][11]_srl32 due to none static srl address bits
WARNING: [Opt 31-1131] Can not pull register out from design_1_i/ps7_0_axi_periph/s00_couplers/auto_pc/inst/gen_axilite.gen_b2s_conv.axilite_b2s/RD.r_channel_0/transaction_fifo_0/memory_reg[31][12]_srl32 due to none static srl address bits
WARNING: [Opt 31-1131] Can not pull register out from design_1_i/ps7_0_axi_periph/s00_couplers/auto_pc/inst/gen_axilite.gen_b2s_conv.axilite_b2s/RD.r_channel_0/transaction_fifo_0/memory_reg[31][1]_srl32 due to none static srl address bits
WARNING: [Opt 31-1131] Can not pull register out from design_1_i/ps7_0_axi_periph/s00_couplers/auto_pc/inst/gen_axilite.gen_b2s_conv.axilite_b2s/RD.r_channel_0/transaction_fifo_0/memory_reg[31][2]_srl32 due to none static srl address bits
WARNING: [Opt 31-1131] Can not pull register out from design_1_i/ps7_0_axi_periph/s00_couplers/auto_pc/inst/gen_axilite.gen_b2s_conv.axilite_b2s/RD.r_channel_0/transaction_fifo_0/memory_reg[31][3]_srl32 due to none static srl address bits
WARNING: [Opt 31-1131] Can not pull register out from design_1_i/ps7_0_axi_periph/s00_couplers/auto_pc/inst/gen_axilite.gen_b2s_conv.axilite_b2s/RD.r_channel_0/transaction_fifo_0/memory_reg[31][4]_srl32 due to none static srl address bits
WARNING: [Opt 31-1131] Can not pull register out from design_1_i/ps7_0_axi_periph/s00_couplers/auto_pc/inst/gen_axilite.gen_b2s_conv.axilite_b2s/RD.r_channel_0/transaction_fifo_0/memory_reg[31][5]_srl32 due to none static srl address bits
WARNING: [Opt 31-1131] Can not pull register out from design_1_i/ps7_0_axi_periph/s00_couplers/auto_pc/inst/gen_axilite.gen_b2s_conv.axilite_b2s/RD.r_channel_0/transaction_fifo_0/memory_reg[31][6]_srl32 due to none static srl address bits
WARNING: [Opt 31-1131] Can not pull register out from design_1_i/ps7_0_axi_periph/s00_couplers/auto_pc/inst/gen_axilite.gen_b2s_conv.axilite_b2s/RD.r_channel_0/transaction_fifo_0/memory_reg[31][7]_srl32 due to none static srl address bits
WARNING: [Opt 31-1131] Can not pull register out from design_1_i/ps7_0_axi_periph/s00_couplers/auto_pc/inst/gen_axilite.gen_b2s_conv.axilite_b2s/RD.r_channel_0/transaction_fifo_0/memory_reg[31][8]_srl32 due to none static srl address bits
WARNING: [Opt 31-1131] Can not pull register out from design_1_i/ps7_0_axi_periph/s00_couplers/auto_pc/inst/gen_axilite.gen_b2s_conv.axilite_b2s/RD.r_channel_0/transaction_fifo_0/memory_reg[31][9]_srl32 due to none static srl address bits
WARNING: [Opt 31-1131] Can not pull register out from design_1_i/ps7_0_axi_periph/s00_couplers/auto_pc/inst/gen_axilite.gen_b2s_conv.axilite_b2s/WR.b_channel_0/bid_fifo_0/memory_reg[3][0]_srl4 due to none static srl address bits
WARNING: [Opt 31-1131] Can not pull register out from design_1_i/ps7_0_axi_periph/s00_couplers/auto_pc/inst/gen_axilite.gen_b2s_conv.axilite_b2s/WR.b_channel_0/bid_fifo_0/memory_reg[3][10]_srl4 due to none static srl address bits
WARNING: [Opt 31-1131] Can not pull register out from design_1_i/ps7_0_axi_periph/s00_couplers/auto_pc/inst/gen_axilite.gen_b2s_conv.axilite_b2s/WR.b_channel_0/bid_fifo_0/memory_reg[3][11]_srl4 due to none static srl address bits
WARNING: [Opt 31-1131] Can not pull register out from design_1_i/ps7_0_axi_periph/s00_couplers/auto_pc/inst/gen_axilite.gen_b2s_conv.axilite_b2s/WR.b_channel_0/bid_fifo_0/memory_reg[3][12]_srl4 due to none static srl address bits
WARNING: [Opt 31-1131] Can not pull register out from design_1_i/ps7_0_axi_periph/s00_couplers/auto_pc/inst/gen_axilite.gen_b2s_conv.axilite_b2s/WR.b_channel_0/bid_fifo_0/memory_reg[3][13]_srl4 due to none static srl address bits
WARNING: [Opt 31-1131] Can not pull register out from design_1_i/ps7_0_axi_periph/s00_couplers/auto_pc/inst/gen_axilite.gen_b2s_conv.axilite_b2s/WR.b_channel_0/bid_fifo_0/memory_reg[3][14]_srl4 due to none static srl address bits
WARNING: [Opt 31-1131] Can not pull register out from design_1_i/ps7_0_axi_periph/s00_couplers/auto_pc/inst/gen_axilite.gen_b2s_conv.axilite_b2s/WR.b_channel_0/bid_fifo_0/memory_reg[3][15]_srl4 due to none static srl address bits
WARNING: [Opt 31-1131] Can not pull register out from design_1_i/ps7_0_axi_periph/s00_couplers/auto_pc/inst/gen_axilite.gen_b2s_conv.axilite_b2s/WR.b_channel_0/bid_fifo_0/memory_reg[3][16]_srl4 due to none static srl address bits
WARNING: [Opt 31-1131] Can not pull register out from design_1_i/ps7_0_axi_periph/s00_couplers/auto_pc/inst/gen_axilite.gen_b2s_conv.axilite_b2s/WR.b_channel_0/bid_fifo_0/memory_reg[3][17]_srl4 due to none static srl address bits
WARNING: [Opt 31-1131] Can not pull register out from design_1_i/ps7_0_axi_periph/s00_couplers/auto_pc/inst/gen_axilite.gen_b2s_conv.axilite_b2s/WR.b_channel_0/bid_fifo_0/memory_reg[3][18]_srl4 due to none static srl address bits
WARNING: [Opt 31-1131] Can not pull register out from design_1_i/ps7_0_axi_periph/s00_couplers/auto_pc/inst/gen_axilite.gen_b2s_conv.axilite_b2s/WR.b_channel_0/bid_fifo_0/memory_reg[3][19]_srl4 due to none static srl address bits
WARNING: [Opt 31-1131] Can not pull register out from design_1_i/ps7_0_axi_periph/s00_couplers/auto_pc/inst/gen_axilite.gen_b2s_conv.axilite_b2s/WR.b_channel_0/bid_fifo_0/memory_reg[3][1]_srl4 due to none static srl address bits
WARNING: [Opt 31-1131] Can not pull register out from design_1_i/ps7_0_axi_periph/s00_couplers/auto_pc/inst/gen_axilite.gen_b2s_conv.axilite_b2s/WR.b_channel_0/bid_fifo_0/memory_reg[3][2]_srl4 due to none static srl address bits
WARNING: [Opt 31-1131] Can not pull register out from design_1_i/ps7_0_axi_periph/s00_couplers/auto_pc/inst/gen_axilite.gen_b2s_conv.axilite_b2s/WR.b_channel_0/bid_fifo_0/memory_reg[3][3]_srl4 due to none static srl address bits
WARNING: [Opt 31-1131] Can not pull register out from design_1_i/ps7_0_axi_periph/s00_couplers/auto_pc/inst/gen_axilite.gen_b2s_conv.axilite_b2s/WR.b_channel_0/bid_fifo_0/memory_reg[3][8]_srl4 due to none static srl address bits
WARNING: [Opt 31-1131] Can not pull register out from design_1_i/ps7_0_axi_periph/s00_couplers/auto_pc/inst/gen_axilite.gen_b2s_conv.axilite_b2s/WR.b_channel_0/bid_fifo_0/memory_reg[3][9]_srl4 due to none static srl address bits
WARNING: [Opt 31-1131] Can not pull register out from design_1_i/ps7_0_axi_periph/s00_couplers/auto_pc/inst/gen_axilite.gen_b2s_conv.axilite_b2s/WR.b_channel_0/bresp_fifo_0/memory_reg[3][0]_srl4 due to none static srl address bits
WARNING: [Opt 31-1131] Can not pull register out from design_1_i/ps7_0_axi_periph/s00_couplers/auto_pc/inst/gen_axilite.gen_b2s_conv.axilite_b2s/WR.b_channel_0/bresp_fifo_0/memory_reg[3][1]_srl4 due to none static srl address bits
INFO: [Opt 31-1064] SRL Remap converted 0 SRLs to 0 registers and converted 0 registers of register chains to 0 SRLs
Phase 7 Shift Register Optimization | Checksum: 1843af04c

Time (s): cpu = 00:00:00 ; elapsed = 00:00:00.717 . Memory (MB): peak = 1909.492 ; gain = 0.000
Shift Register Optimization | Checksum: 1843af04c
INFO: [Opt 31-389] Phase Shift Register Optimization created 0 cells and removed 0 cells

Phase 8 Post Processing Netlist
Phase 8 Post Processing Netlist | Checksum: 15d41ae1e

Time (s): cpu = 00:00:00 ; elapsed = 00:00:00.737 . Memory (MB): peak = 1909.492 ; gain = 0.000
Post Processing Netlist | Checksum: 15d41ae1e
INFO: [Opt 31-389] Phase Post Processing Netlist created 0 cells and removed 0 cells

Phase 9 Finalization

Phase 9.1 Finalizing Design Cores and Updating Shapes
Phase 9.1 Finalizing Design Cores and Updating Shapes | Checksum: 128138a21

Time (s): cpu = 00:00:00 ; elapsed = 00:00:00.833 . Memory (MB): peak = 1909.492 ; gain = 0.000

Phase 9.2 Verifying Netlist Connectivity

Starting Connectivity Check Task

Time (s): cpu = 00:00:00 ; elapsed = 00:00:00.006 . Memory (MB): peak = 1909.492 ; gain = 0.000
Phase 9.2 Verifying Netlist Connectivity | Checksum: 128138a21

Time (s): cpu = 00:00:00 ; elapsed = 00:00:00.843 . Memory (MB): peak = 1909.492 ; gain = 0.000
Phase 9 Finalization | Checksum: 128138a21

Time (s): cpu = 00:00:00 ; elapsed = 00:00:00.845 . Memory (MB): peak = 1909.492 ; gain = 0.000
Opt_design Change Summary
=========================


-------------------------------------------------------------------------------------------------------------------------
|  Phase                        |  #Cells created  |  #Cells Removed  |  #Constrained objects preventing optimizations  |
-------------------------------------------------------------------------------------------------------------------------
|  Retarget                     |               4  |              29  |                                              6  |
|  Constant propagation         |               0  |              30  |                                              0  |
|  Sweep                        |               0  |             174  |                                              0  |
|  BUFG optimization            |               0  |               0  |                                              0  |
|  Shift Register Optimization  |               0  |               0  |                                              0  |
|  Post Processing Netlist      |               0  |               0  |                                              0  |
-------------------------------------------------------------------------------------------------------------------------


Ending Logic Optimization Task | Checksum: 128138a21

Time (s): cpu = 00:00:00 ; elapsed = 00:00:00.850 . Memory (MB): peak = 1909.492 ; gain = 0.000
INFO: [Constraints 18-11670] Building netlist checker database with flags, 0x8
Done building netlist checker database: Time (s): cpu = 00:00:00 ; elapsed = 00:00:00.003 . Memory (MB): peak = 1909.492 ; gain = 0.000

Starting Power Optimization Task
INFO: [Pwropt 34-132] Skipping clock gating for clocks with a period < 2.00 ns.
Ending Power Optimization Task | Checksum: 128138a21

Time (s): cpu = 00:00:00 ; elapsed = 00:00:00.044 . Memory (MB): peak = 1909.492 ; gain = 0.000

Starting Final Cleanup Task
Ending Final Cleanup Task | Checksum: 128138a21

Time (s): cpu = 00:00:00 ; elapsed = 00:00:00.005 . Memory (MB): peak = 1909.492 ; gain = 0.000

Starting Netlist Obfuscation Task
Netlist sorting complete. Time (s): cpu = 00:00:00 ; elapsed = 00:00:00.001 . Memory (MB): peak = 1909.492 ; gain = 0.000
Ending Netlist Obfuscation Task | Checksum: 128138a21

Time (s): cpu = 00:00:00 ; elapsed = 00:00:00.004 . Memory (MB): peak = 1909.492 ; gain = 0.000
INFO: [Common 17-83] Releasing license: Implementation
31 Infos, 63 Warnings, 0 Critical Warnings and 0 Errors encountered.
opt_design completed successfully
opt_design: Time (s): cpu = 00:00:06 ; elapsed = 00:00:10 . Memory (MB): peak = 1909.492 ; gain = 442.762
INFO: [runtcl-4] Executing : report_drc -file design_1_wrapper_drc_opted.rpt -pb design_1_wrapper_drc_opted.pb -rpx design_1_wrapper_drc_opted.rpx
Command: report_drc -file design_1_wrapper_drc_opted.rpt -pb design_1_wrapper_drc_opted.pb -rpx design_1_wrapper_drc_opted.rpx
INFO: [IP_Flow 19-234] Refreshing IP repositories
INFO: [IP_Flow 19-1704] No user IP repositories specified
INFO: [IP_Flow 19-2313] Loaded Vivado IP repository 'C:/Xilinx/Vivado/2023.2/data/ip'.
INFO: [DRC 23-27] Running DRC with 2 threads
INFO: [Vivado_Tcl 2-168] The results of DRC are in file C:/Users/USER/Desktop/EBAZ4205/XilinxFPGA_SE/EBZA4205/05_Zynq7000/project_1/project_1.runs/impl_1/design_1_wrapper_drc_opted.rpt.
report_drc completed successfully
INFO: [Timing 38-480] Writing timing data to binary archive.
Write ShapeDB Complete: Time (s): cpu = 00:00:00 ; elapsed = 00:00:00.027 . Memory (MB): peak = 1909.492 ; gain = 0.000
Wrote PlaceDB: Time (s): cpu = 00:00:01 ; elapsed = 00:00:00.079 . Memory (MB): peak = 1909.492 ; gain = 0.000
Wrote PulsedLatchDB: Time (s): cpu = 00:00:00 ; elapsed = 00:00:00.001 . Memory (MB): peak = 1909.492 ; gain = 0.000
Writing XDEF routing.
Writing XDEF routing logical nets.
Writing XDEF routing special nets.
Wrote RouteStorage: Time (s): cpu = 00:00:00 ; elapsed = 00:00:00.108 . Memory (MB): peak = 1909.492 ; gain = 0.000
Wrote Netlist Cache: Time (s): cpu = 00:00:00 ; elapsed = 00:00:00.002 . Memory (MB): peak = 1909.492 ; gain = 0.000
Wrote Device Cache: Time (s): cpu = 00:00:00 ; elapsed = 00:00:00.038 . Memory (MB): peak = 1909.492 ; gain = 0.000
Write Physdb Complete: Time (s): cpu = 00:00:01 ; elapsed = 00:00:00.247 . Memory (MB): peak = 1909.492 ; gain = 0.000
INFO: [Common 17-1381] The checkpoint 'C:/Users/USER/Desktop/EBAZ4205/XilinxFPGA_SE/EBZA4205/05_Zynq7000/project_1/project_1.runs/impl_1/design_1_wrapper_opt.dcp' has been generated.
Command: place_design
Attempting to get a license for feature 'Implementation' and/or device 'xc7z010'
INFO: [Common 17-349] Got license for feature 'Implementation' and/or device 'xc7z010'
INFO: [Common 17-83] Releasing license: Implementation
INFO: [DRC 23-27] Running DRC with 2 threads
INFO: [Vivado_Tcl 4-198] DRC finished with 0 Errors
INFO: [Vivado_Tcl 4-199] Please refer to the DRC report (report_drc) for more information.
Running DRC as a precondition to command place_design
INFO: [DRC 23-27] Running DRC with 2 threads
INFO: [Vivado_Tcl 4-198] DRC finished with 0 Errors
INFO: [Vivado_Tcl 4-199] Please refer to the DRC report (report_drc) for more information.
INFO: [Place 30-611] Multithreading enabled for place_design using a maximum of 2 CPUs

Starting Placer Task

Phase 1 Placer Initialization

Phase 1.1 Placer Initialization Netlist Sorting
Netlist sorting complete. Time (s): cpu = 00:00:00 ; elapsed = 00:00:00.002 . Memory (MB): peak = 1909.492 ; gain = 0.000
Phase 1.1 Placer Initialization Netlist Sorting | Checksum: af1e09a6

Time (s): cpu = 00:00:00 ; elapsed = 00:00:00.022 . Memory (MB): peak = 1909.492 ; gain = 0.000
Netlist sorting complete. Time (s): cpu = 00:00:00 ; elapsed = 00:00:00.001 . Memory (MB): peak = 1909.492 ; gain = 0.000

Phase 1.2 IO Placement/ Clock Placement/ Build Placer Device
INFO: [Timing 38-35] Done setting XDC timing constraints.
Phase 1.2 IO Placement/ Clock Placement/ Build Placer Device | Checksum: 0c4c8772

Time (s): cpu = 00:00:00 ; elapsed = 00:00:00.933 . Memory (MB): peak = 1909.492 ; gain = 0.000

Phase 1.3 Build Placer Netlist Model
Phase 1.3 Build Placer Netlist Model | Checksum: 927edbe9

Time (s): cpu = 00:00:01 ; elapsed = 00:00:02 . Memory (MB): peak = 1909.492 ; gain = 0.000

Phase 1.4 Constrain Clocks/Macros
Phase 1.4 Constrain Clocks/Macros | Checksum: 927edbe9

Time (s): cpu = 00:00:01 ; elapsed = 00:00:02 . Memory (MB): peak = 1909.492 ; gain = 0.000
Phase 1 Placer Initialization | Checksum: 927edbe9

Time (s): cpu = 00:00:01 ; elapsed = 00:00:02 . Memory (MB): peak = 1909.492 ; gain = 0.000

Phase 2 Global Placement

Phase 2.1 Floorplanning
Phase 2.1 Floorplanning | Checksum: da347dd7

Time (s): cpu = 00:00:01 ; elapsed = 00:00:02 . Memory (MB): peak = 1909.492 ; gain = 0.000

Phase 2.2 Update Timing before SLR Path Opt
Phase 2.2 Update Timing before SLR Path Opt | Checksum: 1059cd29f

Time (s): cpu = 00:00:01 ; elapsed = 00:00:02 . Memory (MB): peak = 1909.492 ; gain = 0.000

Phase 2.3 Post-Processing in Floorplanning
Phase 2.3 Post-Processing in Floorplanning | Checksum: 1059cd29f

Time (s): cpu = 00:00:01 ; elapsed = 00:00:02 . Memory (MB): peak = 1909.492 ; gain = 0.000

Phase 2.4 Global Placement Core

Phase 2.4.1 UpdateTiming Before Physical Synthesis
Phase 2.4.1 UpdateTiming Before Physical Synthesis | Checksum: d20492aa

Time (s): cpu = 00:00:03 ; elapsed = 00:00:04 . Memory (MB): peak = 1909.492 ; gain = 0.000

Phase 2.4.2 Physical Synthesis In Placer
INFO: [Physopt 32-1035] Found 0 LUTNM shape to break, 15 LUT instances to create LUTNM shape
INFO: [Physopt 32-1044] Break lutnm for timing: one critical 0, two critical 0, total 0, new lutff created 0
INFO: [Physopt 32-1138] End 1 Pass. Optimized 6 nets or LUTs. Breaked 0 LUT, combined 6 existing LUTs and moved 0 existing LUT
INFO: [Physopt 32-65] No nets found for high-fanout optimization.
INFO: [Physopt 32-232] Optimized 0 net. Created 0 new instance.
INFO: [Physopt 32-775] End 1 Pass. Optimized 0 net or cell. Created 0 new cell, deleted 0 existing cell and moved 0 existing cell
INFO: [Physopt 32-670] No setup violation found.  DSP Register Optimization was not performed.
INFO: [Physopt 32-670] No setup violation found.  Shift Register to Pipeline Optimization was not performed.
INFO: [Physopt 32-670] No setup violation found.  Shift Register Optimization was not performed.
INFO: [Physopt 32-670] No setup violation found.  BRAM Register Optimization was not performed.
INFO: [Physopt 32-670] No setup violation found.  URAM Register Optimization was not performed.
INFO: [Physopt 32-949] No candidate nets found for dynamic/static region interface net replication
INFO: [Physopt 32-775] End 1 Pass. Optimized 0 net or cell. Created 0 new cell, deleted 0 existing cell and moved 0 existing cell
Netlist sorting complete. Time (s): cpu = 00:00:00 ; elapsed = 00:00:00.001 . Memory (MB): peak = 1909.492 ; gain = 0.000

Summary of Physical Synthesis Optimizations
============================================


-----------------------------------------------------------------------------------------------------------------------------------------------------------
|  Optimization                                     |  Added Cells  |  Removed Cells  |  Optimized Cells/Nets  |  Dont Touch  |  Iterations  |  Elapsed   |
-----------------------------------------------------------------------------------------------------------------------------------------------------------
|  LUT Combining                                    |            0  |              6  |                     6  |           0  |           1  |  00:00:00  |
|  Retime                                           |            0  |              0  |                     0  |           0  |           1  |  00:00:00  |
|  Very High Fanout                                 |            0  |              0  |                     0  |           0  |           1  |  00:00:00  |
|  DSP Register                                     |            0  |              0  |                     0  |           0  |           0  |  00:00:00  |
|  Shift Register to Pipeline                       |            0  |              0  |                     0  |           0  |           0  |  00:00:00  |
|  Shift Register                                   |            0  |              0  |                     0  |           0  |           0  |  00:00:00  |
|  BRAM Register                                    |            0  |              0  |                     0  |           0  |           0  |  00:00:00  |
|  URAM Register                                    |            0  |              0  |                     0  |           0  |           0  |  00:00:00  |
|  Dynamic/Static Region Interface Net Replication  |            0  |              0  |                     0  |           0  |           1  |  00:00:00  |
|  Total                                            |            0  |              6  |                     6  |           0  |           4  |  00:00:00  |
-----------------------------------------------------------------------------------------------------------------------------------------------------------


Phase 2.4.2 Physical Synthesis In Placer | Checksum: e4db8bfc

Time (s): cpu = 00:00:03 ; elapsed = 00:00:05 . Memory (MB): peak = 1909.492 ; gain = 0.000
Phase 2.4 Global Placement Core | Checksum: ea47e141

Time (s): cpu = 00:00:03 ; elapsed = 00:00:05 . Memory (MB): peak = 1909.492 ; gain = 0.000
Phase 2 Global Placement | Checksum: ea47e141

Time (s): cpu = 00:00:03 ; elapsed = 00:00:05 . Memory (MB): peak = 1909.492 ; gain = 0.000

Phase 3 Detail Placement

Phase 3.1 Commit Multi Column Macros
Phase 3.1 Commit Multi Column Macros | Checksum: 123bad4f2

Time (s): cpu = 00:00:03 ; elapsed = 00:00:05 . Memory (MB): peak = 1909.492 ; gain = 0.000

Phase 3.2 Commit Most Macros & LUTRAMs
Phase 3.2 Commit Most Macros & LUTRAMs | Checksum: fd0f8fc5

Time (s): cpu = 00:00:04 ; elapsed = 00:00:05 . Memory (MB): peak = 1909.492 ; gain = 0.000

Phase 3.3 Area Swap Optimization
Phase 3.3 Area Swap Optimization | Checksum: 1526f2ac9

Time (s): cpu = 00:00:04 ; elapsed = 00:00:05 . Memory (MB): peak = 1909.492 ; gain = 0.000

Phase 3.4 Pipeline Register Optimization
Phase 3.4 Pipeline Register Optimization | Checksum: 1258cd393

Time (s): cpu = 00:00:04 ; elapsed = 00:00:05 . Memory (MB): peak = 1909.492 ; gain = 0.000

Phase 3.5 Small Shape Detail Placement
Phase 3.5 Small Shape Detail Placement | Checksum: 14e908863

Time (s): cpu = 00:00:04 ; elapsed = 00:00:06 . Memory (MB): peak = 1909.492 ; gain = 0.000

Phase 3.6 Re-assign LUT pins
Phase 3.6 Re-assign LUT pins | Checksum: 111a96534

Time (s): cpu = 00:00:04 ; elapsed = 00:00:06 . Memory (MB): peak = 1909.492 ; gain = 0.000

Phase 3.7 Pipeline Register Optimization
Phase 3.7 Pipeline Register Optimization | Checksum: 13a8e8bde

Time (s): cpu = 00:00:04 ; elapsed = 00:00:06 . Memory (MB): peak = 1909.492 ; gain = 0.000
Phase 3 Detail Placement | Checksum: 13a8e8bde

Time (s): cpu = 00:00:04 ; elapsed = 00:00:06 . Memory (MB): peak = 1909.492 ; gain = 0.000

Phase 4 Post Placement Optimization and Clean-Up

Phase 4.1 Post Commit Optimization
INFO: [Timing 38-35] Done setting XDC timing constraints.

Phase 4.1.1 Post Placement Optimization
Post Placement Optimization Initialization | Checksum: 17ff516bd

Phase 4.1.1.1 BUFG Insertion

Starting Physical Synthesis Task

Phase 1 Physical Synthesis Initialization
INFO: [Physopt 32-721] Multithreading enabled for phys_opt_design using a maximum of 2 CPUs
INFO: [Physopt 32-619] Estimated Timing Summary | WNS=12.571 | TNS=0.000 |
Phase 1 Physical Synthesis Initialization | Checksum: 1cc4918a5

Time (s): cpu = 00:00:00 ; elapsed = 00:00:00.115 . Memory (MB): peak = 1909.492 ; gain = 0.000
INFO: [Place 46-56] BUFG insertion identified 0 candidate nets. Inserted BUFG: 0, Replicated BUFG Driver: 0, Skipped due to Placement/Routing Conflicts: 0, Skipped due to Timing Degradation: 0, Skipped due to netlist editing failed: 0.
Ending Physical Synthesis Task | Checksum: 1cc4918a5

Time (s): cpu = 00:00:00 ; elapsed = 00:00:00.137 . Memory (MB): peak = 1909.492 ; gain = 0.000
Phase 4.1.1.1 BUFG Insertion | Checksum: 17ff516bd

Time (s): cpu = 00:00:04 ; elapsed = 00:00:07 . Memory (MB): peak = 1909.492 ; gain = 0.000

Phase 4.1.1.2 Post Placement Timing Optimization
INFO: [Place 30-746] Post Placement Timing Summary WNS=12.571. For the most accurate timing information please run report_timing.
Phase 4.1.1.2 Post Placement Timing Optimization | Checksum: 1cbab3081

Time (s): cpu = 00:00:04 ; elapsed = 00:00:07 . Memory (MB): peak = 1909.492 ; gain = 0.000

Time (s): cpu = 00:00:04 ; elapsed = 00:00:07 . Memory (MB): peak = 1909.492 ; gain = 0.000
Phase 4.1 Post Commit Optimization | Checksum: 1cbab3081

Time (s): cpu = 00:00:04 ; elapsed = 00:00:07 . Memory (MB): peak = 1909.492 ; gain = 0.000

Phase 4.2 Post Placement Cleanup
Phase 4.2 Post Placement Cleanup | Checksum: 1cbab3081

Time (s): cpu = 00:00:04 ; elapsed = 00:00:07 . Memory (MB): peak = 1909.492 ; gain = 0.000

Phase 4.3 Placer Reporting

Phase 4.3.1 Print Estimated Congestion
INFO: [Place 30-612] Post-Placement Estimated Congestion 
 ____________________________________________________
|           | Global Congestion | Short Congestion  |
| Direction | Region Size       | Region Size       |
|___________|___________________|___________________|
|      North|                1x1|                1x1|
|___________|___________________|___________________|
|      South|                1x1|                1x1|
|___________|___________________|___________________|
|       East|                1x1|                1x1|
|___________|___________________|___________________|
|       West|                1x1|                1x1|
|___________|___________________|___________________|

Phase 4.3.1 Print Estimated Congestion | Checksum: 1cbab3081

Time (s): cpu = 00:00:04 ; elapsed = 00:00:07 . Memory (MB): peak = 1909.492 ; gain = 0.000
Phase 4.3 Placer Reporting | Checksum: 1cbab3081

Time (s): cpu = 00:00:04 ; elapsed = 00:00:07 . Memory (MB): peak = 1909.492 ; gain = 0.000

Phase 4.4 Final Placement Cleanup
Netlist sorting complete. Time (s): cpu = 00:00:00 ; elapsed = 00:00:00.002 . Memory (MB): peak = 1909.492 ; gain = 0.000

Time (s): cpu = 00:00:04 ; elapsed = 00:00:07 . Memory (MB): peak = 1909.492 ; gain = 0.000
Phase 4 Post Placement Optimization and Clean-Up | Checksum: 1e5052836

Time (s): cpu = 00:00:04 ; elapsed = 00:00:07 . Memory (MB): peak = 1909.492 ; gain = 0.000
Ending Placer Task | Checksum: 16cad8fdf

Time (s): cpu = 00:00:05 ; elapsed = 00:00:07 . Memory (MB): peak = 1909.492 ; gain = 0.000
68 Infos, 63 Warnings, 0 Critical Warnings and 0 Errors encountered.
place_design completed successfully
place_design: Time (s): cpu = 00:00:09 ; elapsed = 00:00:11 . Memory (MB): peak = 1909.492 ; gain = 0.000
INFO: [runtcl-4] Executing : report_io -file design_1_wrapper_io_placed.rpt
report_io: Time (s): cpu = 00:00:00 ; elapsed = 00:00:00.130 . Memory (MB): peak = 1909.492 ; gain = 0.000
INFO: [runtcl-4] Executing : report_utilization -file design_1_wrapper_utilization_placed.rpt -pb design_1_wrapper_utilization_placed.pb
INFO: [runtcl-4] Executing : report_control_sets -verbose -file design_1_wrapper_control_sets_placed.rpt
report_control_sets: Time (s): cpu = 00:00:00 ; elapsed = 00:00:00.015 . Memory (MB): peak = 1909.492 ; gain = 0.000
INFO: [Timing 38-480] Writing timing data to binary archive.
Write ShapeDB Complete: Time (s): cpu = 00:00:00 ; elapsed = 00:00:00.030 . Memory (MB): peak = 1909.492 ; gain = 0.000
Wrote PlaceDB: Time (s): cpu = 00:00:01 ; elapsed = 00:00:00.304 . Memory (MB): peak = 1909.492 ; gain = 0.000
Wrote PulsedLatchDB: Time (s): cpu = 00:00:00 ; elapsed = 00:00:00 . Memory (MB): peak = 1909.492 ; gain = 0.000
Writing XDEF routing.
Writing XDEF routing logical nets.
Writing XDEF routing special nets.
Wrote RouteStorage: Time (s): cpu = 00:00:00 ; elapsed = 00:00:00.079 . Memory (MB): peak = 1909.492 ; gain = 0.000
Wrote Netlist Cache: Time (s): cpu = 00:00:00 ; elapsed = 00:00:00.006 . Memory (MB): peak = 1909.492 ; gain = 0.000
Wrote Device Cache: Time (s): cpu = 00:00:00 ; elapsed = 00:00:00.040 . Memory (MB): peak = 1909.492 ; gain = 0.000
Write Physdb Complete: Time (s): cpu = 00:00:01 ; elapsed = 00:00:00.455 . Memory (MB): peak = 1909.492 ; gain = 0.000
INFO: [Common 17-1381] The checkpoint 'C:/Users/USER/Desktop/EBAZ4205/XilinxFPGA_SE/EBZA4205/05_Zynq7000/project_1/project_1.runs/impl_1/design_1_wrapper_placed.dcp' has been generated.
Command: route_design
Attempting to get a license for feature 'Implementation' and/or device 'xc7z010'
INFO: [Common 17-349] Got license for feature 'Implementation' and/or device 'xc7z010'
Running DRC as a precondition to command route_design
INFO: [DRC 23-27] Running DRC with 2 threads
INFO: [Vivado_Tcl 4-198] DRC finished with 0 Errors
INFO: [Vivado_Tcl 4-199] Please refer to the DRC report (report_drc) for more information.


Starting Routing Task
INFO: [Route 35-254] Multithreading enabled for route_design using a maximum of 8 CPUs

Phase 1 Build RT Design
Checksum: PlaceDB: badd5f9a ConstDB: 0 ShapeSum: b1d03045 RouteDB: 0
Post Restoration Checksum: NetGraph: e7a8fc6a | NumContArr: fb9453ea | Constraints: c2a8fa9d | Timing: c2a8fa9d
Phase 1 Build RT Design | Checksum: 3688f458e

Time (s): cpu = 00:00:23 ; elapsed = 00:00:31 . Memory (MB): peak = 1987.793 ; gain = 78.301

Phase 2 Router Initialization

Phase 2.1 Fix Topology Constraints
Phase 2.1 Fix Topology Constraints | Checksum: 3688f458e

Time (s): cpu = 00:00:23 ; elapsed = 00:00:32 . Memory (MB): peak = 1987.793 ; gain = 78.301

Phase 2.2 Pre Route Cleanup
Phase 2.2 Pre Route Cleanup | Checksum: 3688f458e

Time (s): cpu = 00:00:23 ; elapsed = 00:00:32 . Memory (MB): peak = 1987.793 ; gain = 78.301
 Number of Nodes with overlaps = 0

Phase 2.3 Update Timing
Phase 2.3 Update Timing | Checksum: 2d92a9c4c

Time (s): cpu = 00:00:23 ; elapsed = 00:00:33 . Memory (MB): peak = 2018.242 ; gain = 108.750
INFO: [Route 35-416] Intermediate Timing Summary | WNS=12.631 | TNS=0.000  | WHS=-0.142 | THS=-14.285|


Router Utilization Summary
  Global Vertical Routing Utilization    = 0 %
  Global Horizontal Routing Utilization  = 0 %
  Routable Net Status*
  *Does not include unroutable nets such as driverless and loadless.
  Run report_route_status for detailed report.
  Number of Failed Nets               = 1109
    (Failed Nets is the sum of unrouted and partially routed nets)
  Number of Unrouted Nets             = 1109
  Number of Partially Routed Nets     = 0
  Number of Node Overlaps             = 0

Phase 2 Router Initialization | Checksum: 2c2172020

Time (s): cpu = 00:00:24 ; elapsed = 00:00:33 . Memory (MB): peak = 2024.230 ; gain = 114.738

Phase 3 Initial Routing

Phase 3.1 Global Routing
Phase 3.1 Global Routing | Checksum: 2c2172020

Time (s): cpu = 00:00:24 ; elapsed = 00:00:33 . Memory (MB): peak = 2024.230 ; gain = 114.738

Phase 3.2 Initial Net Routing
Phase 3.2 Initial Net Routing | Checksum: 16a3a4042

Time (s): cpu = 00:00:24 ; elapsed = 00:00:33 . Memory (MB): peak = 2024.230 ; gain = 114.738
Phase 3 Initial Routing | Checksum: 16a3a4042

Time (s): cpu = 00:00:24 ; elapsed = 00:00:33 . Memory (MB): peak = 2024.230 ; gain = 114.738

Phase 4 Rip-up And Reroute

Phase 4.1 Global Iteration 0
 Number of Nodes with overlaps = 44
 Number of Nodes with overlaps = 1
 Number of Nodes with overlaps = 0
INFO: [Route 35-416] Intermediate Timing Summary | WNS=12.065 | TNS=0.000  | WHS=N/A    | THS=N/A    |

Phase 4.1 Global Iteration 0 | Checksum: 2f39843e3

Time (s): cpu = 00:00:25 ; elapsed = 00:00:34 . Memory (MB): peak = 2024.230 ; gain = 114.738
Phase 4 Rip-up And Reroute | Checksum: 2f39843e3

Time (s): cpu = 00:00:25 ; elapsed = 00:00:34 . Memory (MB): peak = 2024.230 ; gain = 114.738

Phase 5 Delay and Skew Optimization

Phase 5.1 Delay CleanUp

Phase 5.1.1 Update Timing
Phase 5.1.1 Update Timing | Checksum: 2eef3c05a

Time (s): cpu = 00:00:25 ; elapsed = 00:00:34 . Memory (MB): peak = 2024.230 ; gain = 114.738
INFO: [Route 35-416] Intermediate Timing Summary | WNS=12.180 | TNS=0.000  | WHS=N/A    | THS=N/A    |

Phase 5.1 Delay CleanUp | Checksum: 2eef3c05a

Time (s): cpu = 00:00:25 ; elapsed = 00:00:34 . Memory (MB): peak = 2024.230 ; gain = 114.738

Phase 5.2 Clock Skew Optimization
Phase 5.2 Clock Skew Optimization | Checksum: 2eef3c05a

Time (s): cpu = 00:00:25 ; elapsed = 00:00:34 . Memory (MB): peak = 2024.230 ; gain = 114.738
Phase 5 Delay and Skew Optimization | Checksum: 2eef3c05a

Time (s): cpu = 00:00:25 ; elapsed = 00:00:34 . Memory (MB): peak = 2024.230 ; gain = 114.738

Phase 6 Post Hold Fix

Phase 6.1 Hold Fix Iter

Phase 6.1.1 Update Timing
Phase 6.1.1 Update Timing | Checksum: 26b8b44a7

Time (s): cpu = 00:00:25 ; elapsed = 00:00:34 . Memory (MB): peak = 2024.230 ; gain = 114.738
INFO: [Route 35-416] Intermediate Timing Summary | WNS=12.180 | TNS=0.000  | WHS=0.036  | THS=0.000  |

Phase 6.1 Hold Fix Iter | Checksum: 26c998202

Time (s): cpu = 00:00:25 ; elapsed = 00:00:34 . Memory (MB): peak = 2024.230 ; gain = 114.738
Phase 6 Post Hold Fix | Checksum: 26c998202

Time (s): cpu = 00:00:25 ; elapsed = 00:00:34 . Memory (MB): peak = 2024.230 ; gain = 114.738

Phase 7 Route finalize

Router Utilization Summary
  Global Vertical Routing Utilization    = 0.397523 %
  Global Horizontal Routing Utilization  = 0.617188 %
  Routable Net Status*
  *Does not include unroutable nets such as driverless and loadless.
  Run report_route_status for detailed report.
  Number of Failed Nets               = 0
    (Failed Nets is the sum of unrouted and partially routed nets)
  Number of Unrouted Nets             = 0
  Number of Partially Routed Nets     = 0
  Number of Node Overlaps             = 0

Phase 7 Route finalize | Checksum: 26c998202

Time (s): cpu = 00:00:25 ; elapsed = 00:00:34 . Memory (MB): peak = 2024.230 ; gain = 114.738

Phase 8 Verifying routed nets

 Verification completed successfully
Phase 8 Verifying routed nets | Checksum: 26c998202

Time (s): cpu = 00:00:25 ; elapsed = 00:00:34 . Memory (MB): peak = 2025.320 ; gain = 115.828

Phase 9 Depositing Routes
Phase 9 Depositing Routes | Checksum: 21b19b4eb

Time (s): cpu = 00:00:25 ; elapsed = 00:00:34 . Memory (MB): peak = 2025.320 ; gain = 115.828

Phase 10 Post Router Timing
INFO: [Route 35-57] Estimated Timing Summary | WNS=12.180 | TNS=0.000  | WHS=0.036  | THS=0.000  |

INFO: [Route 35-327] The final timing numbers are based on the router estimated timing analysis. For a complete and accurate timing signoff, please run report_timing_summary.
Phase 10 Post Router Timing | Checksum: 21b19b4eb

Time (s): cpu = 00:00:25 ; elapsed = 00:00:34 . Memory (MB): peak = 2025.320 ; gain = 115.828
INFO: [Route 35-16] Router Completed Successfully

Phase 11 Post-Route Event Processing
Phase 11 Post-Route Event Processing | Checksum: 27c2d95d8

Time (s): cpu = 00:00:25 ; elapsed = 00:00:34 . Memory (MB): peak = 2025.320 ; gain = 115.828
Ending Routing Task | Checksum: 27c2d95d8

Time (s): cpu = 00:00:25 ; elapsed = 00:00:34 . Memory (MB): peak = 2025.320 ; gain = 115.828

Routing Is Done.
INFO: [Common 17-83] Releasing license: Implementation
86 Infos, 63 Warnings, 0 Critical Warnings and 0 Errors encountered.
route_design completed successfully
route_design: Time (s): cpu = 00:00:29 ; elapsed = 00:00:38 . Memory (MB): peak = 2025.320 ; gain = 115.828
INFO: [runtcl-4] Executing : report_drc -file design_1_wrapper_drc_routed.rpt -pb design_1_wrapper_drc_routed.pb -rpx design_1_wrapper_drc_routed.rpx
Command: report_drc -file design_1_wrapper_drc_routed.rpt -pb design_1_wrapper_drc_routed.pb -rpx design_1_wrapper_drc_routed.rpx
INFO: [IP_Flow 19-1839] IP Catalog is up to date.
INFO: [DRC 23-27] Running DRC with 2 threads
INFO: [Vivado_Tcl 2-168] The results of DRC are in file C:/Users/USER/Desktop/EBAZ4205/XilinxFPGA_SE/EBZA4205/05_Zynq7000/project_1/project_1.runs/impl_1/design_1_wrapper_drc_routed.rpt.
report_drc completed successfully
INFO: [runtcl-4] Executing : report_methodology -file design_1_wrapper_methodology_drc_routed.rpt -pb design_1_wrapper_methodology_drc_routed.pb -rpx design_1_wrapper_methodology_drc_routed.rpx
Command: report_methodology -file design_1_wrapper_methodology_drc_routed.rpt -pb design_1_wrapper_methodology_drc_routed.pb -rpx design_1_wrapper_methodology_drc_routed.rpx
INFO: [Timing 38-35] Done setting XDC timing constraints.
INFO: [DRC 23-133] Running Methodology with 2 threads
INFO: [Vivado_Tcl 2-1520] The results of Report Methodology are in file C:/Users/USER/Desktop/EBAZ4205/XilinxFPGA_SE/EBZA4205/05_Zynq7000/project_1/project_1.runs/impl_1/design_1_wrapper_methodology_drc_routed.rpt.
report_methodology completed successfully
INFO: [runtcl-4] Executing : report_power -file design_1_wrapper_power_routed.rpt -pb design_1_wrapper_power_summary_routed.pb -rpx design_1_wrapper_power_routed.rpx
Command: report_power -file design_1_wrapper_power_routed.rpt -pb design_1_wrapper_power_summary_routed.pb -rpx design_1_wrapper_power_routed.rpx
INFO: [Timing 38-35] Done setting XDC timing constraints.
Running Vector-less Activity Propagation...

Finished Running Vector-less Activity Propagation
96 Infos, 63 Warnings, 0 Critical Warnings and 0 Errors encountered.
report_power completed successfully
INFO: [runtcl-4] Executing : report_route_status -file design_1_wrapper_route_status.rpt -pb design_1_wrapper_route_status.pb
INFO: [runtcl-4] Executing : report_timing_summary -max_paths 10 -file design_1_wrapper_timing_summary_routed.rpt -pb design_1_wrapper_timing_summary_routed.pb -rpx design_1_wrapper_timing_summary_routed.rpx -warn_on_violation 
INFO: [Timing 38-91] UpdateTimingParams: Speed grade: -1, Delay Type: min_max.
INFO: [Timing 38-191] Multithreading enabled for timing update using a maximum of 2 CPUs
INFO: [runtcl-4] Executing : report_incremental_reuse -file design_1_wrapper_incremental_reuse_routed.rpt
INFO: [Vivado_Tcl 4-1062] Incremental flow is disabled. No incremental reuse Info to report.
INFO: [runtcl-4] Executing : report_clock_utilization -file design_1_wrapper_clock_utilization_routed.rpt
INFO: [runtcl-4] Executing : report_bus_skew -warn_on_violation -file design_1_wrapper_bus_skew_routed.rpt -pb design_1_wrapper_bus_skew_routed.pb -rpx design_1_wrapper_bus_skew_routed.rpx
INFO: [Timing 38-91] UpdateTimingParams: Speed grade: -1, Delay Type: min_max.
INFO: [Timing 38-191] Multithreading enabled for timing update using a maximum of 2 CPUs
INFO: [Timing 38-480] Writing timing data to binary archive.
Write ShapeDB Complete: Time (s): cpu = 00:00:00 ; elapsed = 00:00:00.056 . Memory (MB): peak = 2035.184 ; gain = 0.000
Wrote PlaceDB: Time (s): cpu = 00:00:01 ; elapsed = 00:00:00.375 . Memory (MB): peak = 2035.184 ; gain = 0.000
Wrote PulsedLatchDB: Time (s): cpu = 00:00:00 ; elapsed = 00:00:00.001 . Memory (MB): peak = 2035.184 ; gain = 0.000
Writing XDEF routing.
Writing XDEF routing logical nets.
Writing XDEF routing special nets.
Wrote RouteStorage: Time (s): cpu = 00:00:00 ; elapsed = 00:00:00.127 . Memory (MB): peak = 2035.184 ; gain = 0.000
Wrote Netlist Cache: Time (s): cpu = 00:00:00 ; elapsed = 00:00:00.006 . Memory (MB): peak = 2035.184 ; gain = 0.000
Wrote Device Cache: Time (s): cpu = 00:00:00 ; elapsed = 00:00:00.064 . Memory (MB): peak = 2035.184 ; gain = 0.000
Write Physdb Complete: Time (s): cpu = 00:00:01 ; elapsed = 00:00:00.604 . Memory (MB): peak = 2035.184 ; gain = 0.000
INFO: [Common 17-1381] The checkpoint 'C:/Users/USER/Desktop/EBAZ4205/XilinxFPGA_SE/EBZA4205/05_Zynq7000/project_1/project_1.runs/impl_1/design_1_wrapper_routed.dcp' has been generated.
INFO: [Common 17-206] Exiting Vivado at Mon Apr  1 21:54:47 2024...

*** Running vivado
    with args -log design_1_wrapper.vdi -applog -m64 -product Vivado -messageDb vivado.pb -mode batch -source design_1_wrapper.tcl -notrace


ECHO は <OFF> です。
ECHO は <OFF> です。

****** Vivado v2023.2 (64-bit)
  **** SW Build 4029153 on Fri Oct 13 20:14:34 MDT 2023
  **** IP Build 4028589 on Sat Oct 14 00:45:43 MDT 2023
  **** SharedData Build 4025554 on Tue Oct 10 17:18:54 MDT 2023
    ** Copyright 1986-2022 Xilinx, Inc. All Rights Reserved.
    ** Copyright 2022-2023 Advanced Micro Devices, Inc. All Rights Reserved.

source design_1_wrapper.tcl -notrace
Command: open_checkpoint design_1_wrapper_routed.dcp
INFO: [Device 21-403] Loading part xc7z010clg400-1
Netlist sorting complete. Time (s): cpu = 00:00:00 ; elapsed = 00:00:00.077 . Memory (MB): peak = 852.215 ; gain = 0.000
INFO: [Netlist 29-17] Analyzing 23 Unisim elements for replacement
INFO: [Netlist 29-28] Unisim Transformation completed in 0 CPU seconds
INFO: [Project 1-479] Netlist was created with Vivado 2023.2
INFO: [Project 1-570] Preparing netlist for logic optimization
Read ShapeDB Complete: Time (s): cpu = 00:00:00 ; elapsed = 00:00:00.021 . Memory (MB): peak = 952.602 ; gain = 0.555
INFO: [Timing 38-478] Restoring timing data from binary archive.
INFO: [Timing 38-479] Binary timing data restore complete.
INFO: [Project 1-856] Restoring constraints from binary archive.
INFO: [Project 1-853] Binary constraint restore complete.
INFO: [Designutils 20-5722] Start Reading Physical Databases.
Reading placement.
Read Netlist Cache: Time (s): cpu = 00:00:00 ; elapsed = 00:00:00.009 . Memory (MB): peak = 1540.793 ; gain = 0.000
Reading placer database...
Read Device Cache: Time (s): cpu = 00:00:00 ; elapsed = 00:00:00.046 . Memory (MB): peak = 1540.793 ; gain = 0.000
Read PlaceDB: Time (s): cpu = 00:00:00 ; elapsed = 00:00:00.345 . Memory (MB): peak = 1540.793 ; gain = 0.000
Read PulsedLatchDB: Time (s): cpu = 00:00:00 ; elapsed = 00:00:00 . Memory (MB): peak = 1540.793 ; gain = 0.000
Reading routing.
Read RouteStorage: Time (s): cpu = 00:00:00 ; elapsed = 00:00:00.190 . Memory (MB): peak = 1540.793 ; gain = 0.000
Read Physdb Files: Time (s): cpu = 00:00:00 ; elapsed = 00:00:00.645 . Memory (MB): peak = 1540.793 ; gain = 0.000
Restored from archive | CPU: 0.000000 secs | Memory: 0.000000 MB |
Finished XDEF File Restore: Time (s): cpu = 00:00:00 ; elapsed = 00:00:00.829 . Memory (MB): peak = 1540.793 ; gain = 8.199
Netlist sorting complete. Time (s): cpu = 00:00:00 ; elapsed = 00:00:00.001 . Memory (MB): peak = 1540.793 ; gain = 0.000
INFO: [Project 1-111] Unisim Transformation Summary:
  A total of 5 instances were transformed.
  IOBUF => IOBUF (IBUF, OBUFT): 5 instances

指定されたパスが見つかりません。
INFO: [Project 1-604] Checkpoint was created with Vivado v2023.2 (64-bit) build 4029153
open_checkpoint: Time (s): cpu = 00:00:17 ; elapsed = 00:00:41 . Memory (MB): peak = 1540.793 ; gain = 1268.469
Command: write_bitstream -force design_1_wrapper.bit
Attempting to get a license for feature 'Implementation' and/or device 'xc7z010'
INFO: [Common 17-349] Got license for feature 'Implementation' and/or device 'xc7z010'
Running DRC as a precondition to command write_bitstream
INFO: [IP_Flow 19-234] Refreshing IP repositories
INFO: [IP_Flow 19-1704] No user IP repositories specified
INFO: [IP_Flow 19-2313] Loaded Vivado IP repository 'C:/Xilinx/Vivado/2023.2/data/ip'.
INFO: [DRC 23-27] Running DRC with 2 threads
INFO: [Vivado 12-3199] DRC finished with 0 Errors
INFO: [Vivado 12-3200] Please refer to the DRC report (report_drc) for more information.
INFO: [Designutils 20-2272] Running write_bitstream with 2 threads.
Loading data files...
Loading site data...
Loading route data...
Processing options...
Creating bitmap...
Creating bitstream...
Writing bitstream ./design_1_wrapper.bit...
INFO: [Vivado 12-1842] Bitgen Completed Successfully.
INFO: [Project 1-1876] WebTalk data collection is mandatory when using a ULT device. To see the specific WebTalk data collected for your design, open the usage_statistics_webtalk.html or usage_statistics_webtalk.xml file in the implementation directory.
INFO: [Common 17-83] Releasing license: Implementation
23 Infos, 0 Warnings, 0 Critical Warnings and 0 Errors encountered.
write_bitstream completed successfully
write_bitstream: Time (s): cpu = 00:00:15 ; elapsed = 00:00:21 . Memory (MB): peak = 2020.586 ; gain = 479.793
INFO: [Common 17-206] Exiting Vivado at Mon Apr  1 21:57:33 2024...
